{
  "$schema": "../../schema/module.v1.json",
  "id": "waste-recycling",
  "name": {
    "fr": "Tri & déchets",
    "en": "Recycling & waste"
  },
  "description": {
    "fr": "Bac par bac : où jeter quoi, jours de collecte.",
    "en": "Bin by bin: what goes where, collection days."
  },
  "details": {
    "fr": "`bins_json` est un tableau : chaque bac a un `id`, un `title` {fr,en} et une liste `items` (lignes FR/EN). Utilisez `collection_schedule` pour les jours de passage, liens mairie, etc.",
    "en": "`bins_json` is an array: each bin has `id`, `title` {fr,en}, and `items` lines. Use `collection_schedule` for pickup days and town links."
  },
  "examples": [
    {
      "title": { "fr": "Jaune + vert", "en": "Yellow + green" },
      "description": {
        "fr": "Deux entrées JSON pour emballages et verre.",
        "en": "Two JSON entries for packaging and glass."
      },
      "link": "https://github.com/PortakiApp/portaki-sdk/tree/develop/packages/waste-recycling"
    }
  ],
  "version": "1.0.0",
  "author": {
    "name": "Portaki",
    "url": "https://portaki.app",
    "type": "official"
  },
  "icon": "recycle",
  "type": "official",
  "tags": ["waste", "recycling", "guest", "city"],
  "portakiVersionMin": "1.0.0",
  "license": "AGPL-3.0",
  "repository": "https://github.com/PortakiApp/portaki-sdk",
  "screenshots": [],
  "config": {
    "defaults": {},
    "globalAlert": {
      "type": "info",
      "message": {
        "fr": "Le JSON décrit les bacs (couleur ou nom) et ce qu’ils acceptent. Complétez avec les jours de passage en texte libre.",
        "en": "JSON describes bins (colour or name) and what they accept. Add pickup days in the free-text field."
      },
      "helpUrl": "https://github.com/PortakiApp/portaki-sdk/tree/develop/packages/waste-recycling"
    },
    "fields": [
      {
        "key": "bins_json",
        "label": { "fr": "Bacs & consignes (JSON)", "en": "Bins & rules (JSON)" },
        "description": {
          "fr": "Exemple : [{\"id\":\"yellow\",\"title\":{\"fr\":\"Emballages\",\"en\":\"Recycling\"},\"items\":[{\"fr\":\"Plastique, carton, métal\",\"en\":\"Plastic, cardboard, metal\"}]},{\"id\":\"green\",\"title\":{\"fr\":\"Verre\",\"en\":\"Glass\"},\"items\":[{\"fr\":\"Bouteilles sans bouchon\",\"en\":\"Bottles, no lids\"}]}]",
          "en": "Example: [{\"id\":\"yellow\",\"title\":{\"fr\":\"...\",\"en\":\"Recycling\"},\"items\":[{\"fr\":\"...\",\"en\":\"...\"}]}]"
        },
        "type": "textarea",
        "required": true
      },
      {
        "key": "collection_schedule",
        "label": { "fr": "Jours de collecte (optionnel)", "en": "Collection schedule (optional)" },
        "description": {
          "fr": "Texte libre : « Poubelles jaunes le mardi », liens mairie, etc.",
          "en": "Free text: “Yellow bin Tuesdays”, town hall links, etc."
        },
        "type": "textarea",
        "required": false
      }
    ]
  },
  "catalog": {
    "tagline": {
      "fr": "Tri local clair pour éviter les erreurs de bac.",
      "en": "Clear local sorting for guests."
    },
    "highlights": [
      {
        "fr": "JSON + texte libre calendrier",
        "en": "JSON + free-text schedule"
      },
      {
        "fr": "Alerte hôte intégrée au configurateur",
        "en": "Host-facing alert in configurator"
      }
    ],
    "npmPackage": "@portaki/module-waste-recycling",
    "npmUrl": "https://www.npmjs.com/package/@portaki/module-waste-recycling"
  }
}
