{
  "$schema": "../../schema/module.v1.json",
  "id": "events",
  "name": {
    "fr": "Événements locaux",
    "en": "Local events"
  },
  "description": {
    "fr": "Événements à proximité du logement via OpenAgenda.",
    "en": "Events near the property via OpenAgenda."
  },
  "details": {
    "fr": "Les données proviennent d’OpenAgenda (France). Le rayon et les sources peuvent être affinés côté produit ; une clé API optionnelle augmente les quotas.\n\nPensez à vérifier les horaires sur les sites des organisateurs.",
    "en": "Data comes from OpenAgenda (France). Radius and sources may be tuned in the product; an optional API key increases quotas.\n\nAlways double-check times on organizer websites."
  },
  "examples": [
    {
      "title": { "fr": "Carte + liste", "en": "Map + list" },
      "description": {
        "fr": "Repères sur la carte invité et liste des événements à venir.",
        "en": "Pins on the guest map plus a list of upcoming happenings."
      },
      "link": "https://github.com/PortakiApp/portaki-sdk/tree/develop/packages/events"
    }
  ],
  "version": "1.0.0",
  "author": {
    "name": "Portaki",
    "url": "https://portaki.app",
    "type": "official"
  },
  "icon": "calendar-days",
  "type": "official",
  "tags": ["events", "openagenda", "culture", "map"],
  "portakiVersionMin": "1.0.0",
  "license": "AGPL-3.0",
  "repository": "https://github.com/PortakiApp/portaki-sdk",
  "screenshots": [],
  "config": {
    "defaults": {
      "openagenda_api_key": ""
    },
    "fields": [
      {
        "key": "openagenda_api_key",
        "label": {
          "fr": "Clé API OpenAgenda (optionnelle)",
          "en": "OpenAgenda API key (optional)"
        },
        "description": {
          "fr": "Augmente les quotas. Sans clé, usage mutualisé selon disponibilité.",
          "en": "Increases quotas. Without a key, shared usage when available."
        },
        "type": "secret",
        "required": false,
        "helpUrl": "https://openagenda.com/"
      }
    ]
  },
  "catalog": {
    "tagline": {
      "fr": "Annonce locale et carte pour tout ce qui bouge autour du logement.",
      "en": "Local listings and a map for everything happening around the property."
    },
    "highlights": [
      {
        "fr": "Point de menu « Événements » sur la page voyageur",
        "en": "“Events” menu entry on the guest page"
      },
      {
        "fr": "Carte : overlay et hook `mapMarkers` pour vos données",
        "en": "Map: overlay and `mapMarkers` hook for your data"
      },
      {
        "fr": "Composant prêt à brancher sur votre API locale",
        "en": "Component ready to wire to your local API"
      }
    ],
    "npmPackage": "@portaki/module-events",
    "npmUrl": "https://www.npmjs.com/package/@portaki/module-events"
  }
}
