{
  "$schema": "../../schema/module.v1.json",
  "id": "wifi-guest",
  "name": {
    "fr": "Wi‑Fi invité",
    "en": "Guest Wi‑Fi"
  },
  "description": {
    "fr": "Réseau dédié voyageurs : SSID, mot de passe chiffré côté stockage, aide à la connexion.",
    "en": "Guest network: SSID, password stored encrypted, connection help."
  },
  "details": {
    "fr": "Le mot de passe est **visible sur la page invité** après déchiffrement serveur. Utilisez un SSID/mot de passe dédié aux séjours, distinct de votre réseau personnel.\n\nLes champs optionnels permettent d’expliquer le 2,4 vs 5 GHz ou un portail captif.",
    "en": "The password is **visible on the guest page** after server decrypt. Use guest-only SSID/password, separate from your home network.\n\nOptional fields explain 2.4 vs 5 GHz or a captive portal."
  },
  "examples": [
    {
      "title": { "fr": "Réseau mesh", "en": "Mesh network" },
      "description": {
        "fr": "Indiquez dans « astuce » les deux SSID si le logement en a deux.",
        "en": "Use the band hint for dual SSID mesh setups."
      },
      "link": "https://github.com/PortakiApp/portaki-sdk/tree/develop/packages/wifi-guest"
    }
  ],
  "version": "1.0.0",
  "author": {
    "name": "Portaki",
    "url": "https://portaki.app",
    "type": "official"
  },
  "icon": "wifi",
  "type": "official",
  "tags": ["wifi", "network", "guest"],
  "portakiVersionMin": "1.0.0",
  "license": "AGPL-3.0",
  "repository": "https://github.com/PortakiApp/portaki-sdk",
  "screenshots": [],
  "config": {
    "defaults": {},
    "globalAlert": {
      "type": "warning",
      "message": {
        "fr": "Le mot de passe est visible sur la page invité. Utilisez un réseau ou mot de passe dédié aux séjours.",
        "en": "The password is visible on the guest page. Use a guest-only network or password."
      }
    },
    "fields": [
      {
        "key": "ssid",
        "label": { "fr": "Nom du réseau (SSID)", "en": "Network name (SSID)" },
        "description": {
          "fr": "Réseau recommandé pour les voyageurs (ex. Villa-Guest).",
          "en": "Recommended guest network name."
        },
        "type": "text",
        "required": true,
        "placeholder": { "fr": "MonLogement-Guest", "en": "MyPlace-Guest" }
      },
      {
        "key": "password",
        "label": { "fr": "Mot de passe Wi‑Fi", "en": "Wi‑Fi password" },
        "description": {
          "fr": "Stocké chiffré côté serveur ; déchiffré pour l’affichage invité uniquement.",
          "en": "Stored encrypted server-side; decrypted for guest display only."
        },
        "type": "secret",
        "required": true
      },
      {
        "key": "band_hint",
        "label": { "fr": "Bande / astuce (optionnel)", "en": "Band / hint (optional)" },
        "description": {
          "fr": "Ex. « Privilégiez le 2,4 GHz au fond du jardin ».",
          "en": "e.g. “Prefer 2.4 GHz at the far end of the garden.”"
        },
        "type": "text",
        "required": false,
        "placeholder": {
          "fr": "2,4 GHz : MonLogement-Guest / 5 GHz : MonLogement-Guest-5G",
          "en": "2.4 GHz: MyPlace-Guest / 5 GHz: MyPlace-Guest-5G"
        }
      },
      {
        "key": "connection_steps",
        "label": { "fr": "Étapes de connexion (optionnel)", "en": "Connection steps (optional)" },
        "description": {
          "fr": "Courtes instructions (portail captif, bouton WPS, etc.).",
          "en": "Short instructions (captive portal, WPS, etc.)."
        },
        "type": "textarea",
        "required": false
      }
    ]
  },
  "catalog": {
    "tagline": {
      "fr": "Wi‑Fi invité clair, sans passer par la fiche « Infos pratiques » seule.",
      "en": "Clear guest Wi‑Fi beyond the practical info card alone."
    },
    "highlights": [
      {
        "fr": "Secret chiffré au repos",
        "en": "Secret encrypted at rest"
      },
      {
        "fr": "Instructions longues (textarea)",
        "en": "Long instructions (textarea)"
      }
    ],
    "npmPackage": "@portaki/module-wifi-guest",
    "npmUrl": "https://www.npmjs.com/package/@portaki/module-wifi-guest"
  }
}
