{
  "$schema": "../../schema/module.v1.json",
  "id": "checklist",
  "name": {
    "fr": "Checklist départ",
    "en": "Checkout checklist"
  },
  "description": {
    "fr": "Liste cochable pour le départ avec progression sauvegardée.",
    "en": "Checkable departure list with saved progress."
  },
  "details": {
    "fr": "Définissez les tâches (poubelles, lave-vaisselle, clés…) dans le configurateur hôte. Le voyageur coche sur son téléphone ; l’état est mémorisé pour le séjour.\n\nIdéal pour réduire les oublis en fin de location.",
    "en": "Define tasks (bins, dishwasher, keys…) in the host configurator. Guests check off on their phone; state is remembered for the stay.\n\nGreat for reducing end-of-stay oversights."
  },
  "examples": [
    {
      "title": { "fr": "Barre de progression", "en": "Progress bar" },
      "description": {
        "fr": "Le voyageur voit combien d’étapes restent avant un départ sans stress.",
        "en": "Guests see how many steps remain before a stress-free checkout."
      },
      "link": "https://github.com/PortakiApp/portaki-sdk/tree/develop/packages/checklist"
    }
  ],
  "version": "1.0.0",
  "author": {
    "name": "Portaki",
    "url": "https://portaki.app",
    "type": "official"
  },
  "icon": "list-checks",
  "type": "official",
  "tags": ["checklist", "departure", "guest", "tasks"],
  "portakiVersionMin": "1.0.0",
  "license": "AGPL-3.0",
  "repository": "https://github.com/PortakiApp/portaki-sdk",
  "screenshots": [],
  "config": {
    "defaults": {},
    "fields": []
  },
  "catalog": {
    "tagline": {
      "fr": "Liste de départ · persistance invité · FR / EN.",
      "en": "Departure list · guest persistence · FR / EN."
    },
    "highlights": [
      {
        "fr": "Affichage sur séjour actif (selon statut configuré)",
        "en": "Shown on active stay (per configured status)"
      },
      {
        "fr": "Libellés FR / EN via la configuration propriété",
        "en": "FR / EN labels via property configuration"
      },
      {
        "fr": "Hooks pour enregistrer l’état de chaque item",
        "en": "Hooks to persist each item’s state"
      }
    ],
    "npmPackage": "@portaki/module-checklist",
    "npmUrl": "https://www.npmjs.com/package/@portaki/module-checklist"
  }
}
